date,OT,start_date,end_date,search_fact,report_fact
2017-05-01,215861421,2017-05-01,2017-05-31,"The United States has various government agencies and programs in place to mitigate and respond to disasters, such as FEMA's Hazard Mitigation Grants and the National Business Emergency Operations Center.; The North Castle Citizen Corps Council (NC4) is a group of volunteers organized under the U.S. Department of Homeland Security Americorps Program, aiming to prepare for disasters and emergencies.; The United States has various emergency operations plans and disaster assistance programs in place, including the HI-EOP, FEMA, and USDA's Farm Service Agency.; The State of Vermont has a vision to be safe and resilient in the face of climate change and natural disasters, with a mission to protect life, property, natural resources, and the economy.; The field of emergency management and homeland security is growing in the United States and around the world.",NA
2017-06-01,278268154,2017-06-01,2017-06-30,"The field of emergency management and homeland security is growing in the United States and around the world.; The Robert T. Stafford Disaster Relief and Emergency Assistance Act is a federal law that provides assistance to states and local governments in responding to disasters.; The United States is prone to natural disasters such as earthquakes, tsunamis, volcanic eruptions, forest fires, and landslides.; The Federal Emergency Management Agency (FEMA) provides assistance to states and individuals affected by major disasters or emergencies declared by the President.; The negative effects from natural disasters may rise due to increased economic ability of the state and/or affected localities to recover from the incident.",NA
2017-07-01,384463006,2017-07-01,2017-07-31,"The negative effects from natural disasters may rise due to increased economic ability of the state and/or affected localities to recover from the incident.; The United States is providing disaster preparedness assistance to other countries, such as Montenegro.; The Federal Emergency Management Agency (FEMA) provides disaster recovery assistance to states and applicants through its Public Assistance Program.; Objective facts about the Climate and Disaster situation:
In the event of a major emergency or disaster, state and federal agencies provide emergency response advice and activate their emergency operations centers.; The United States has designated many counties as disaster areas to make emergency loans available to farmers and ranchers affected by drought.; Objective facts about the Climate and Disaster situation:
The Federal Emergency Management Agency (FEMA) is a U.S. government agency tasked with disaster mitigation, preparedness, response, and recovery planning. 
Research has shown that older adults are vulnerable in disasters, with increased mortality rates during cyclonic storms.",NA
2017-08-01,255296730,2017-08-01,2017-08-31,"Objective facts about the Climate and Disaster situation:
The Federal Emergency Management Agency (FEMA) is a U.S. government agency tasked with disaster mitigation, preparedness, response, and recovery planning. 
Research has shown that older adults are vulnerable in disasters, with increased mortality rates during cyclonic storms.; The United States has various government agencies and offices dedicated to emergency management and disaster preparedness, such as the Federal Emergency Management Agency (FEMA) and local emergency management offices.; The United States government, through agencies like FEMA, is actively preparing for disaster relief and emergency response, conducting exercises like Vigilant Guard and providing resources for community emergency response teams.; The United States government has official websites and offices dedicated to emergency management and disaster preparedness, such as the Office of Emergency Management and the Office of Nursing Services.; The United States government has official websites and resources dedicated to disaster management and relief, including FEMA.gov, DHS.gov, and CDC.gov.",NA
2017-09-01,600000384,2017-09-01,2017-09-30,"The United States government has official websites and resources dedicated to disaster management and relief, including FEMA.gov, DHS.gov, and CDC.gov.; Objective facts about the Climate and Disaster situation:
In the United States, states focus on four stages of disaster or emergency management. 
State and local emergency management agencies have the responsibility to prepare for and respond to disasters.; In 2016, the federal government made assistance available to state governments for 103 declared disasters and emergencies, including fires, natural disasters, and other emergencies.; The Federal Emergency Management Agency (FEMA) had pre-positioned supplies and personnel in Texas before Hurricane Harvey made landfall on August 25, 2017.; The President of the United States can declare a state of emergency or major disaster, which can activate national security emergencies or other emergency or disaster conditions.",NA
2017-10-01,1717651342,2017-10-01,2017-10-31,"The President of the United States can declare a state of emergency or major disaster, which can activate national security emergencies or other emergency or disaster conditions.; The Federal Emergency Management Agency (FEMA) provides funds and services to people in disaster situations, and coordinates emergency response capabilities.; The United States has a National Response Framework (NRF) that coordinates federal, state, local, and private emergency resources in response to disasters or emergencies, usually at the request of a state governor.; The U.S. Army Corps of Engineers can provide assistance to state and local agencies following natural disasters.; The United States Senate has passed a $36.5 billion emergency supplemental bill, which includes $18.7 billion for disaster relief.; The U.S. Army Corps of Engineers may respond to disaster situations under its own authorities, provide support to civil authorities, and support the Federal Emergency Management Agency (FEMA) in responding to domestic disasters and emergencies.",NA
2017-11-01,1012391516,2017-11-01,2017-11-30,"The U.S. Army Corps of Engineers may respond to disaster situations under its own authorities, provide support to civil authorities, and support the Federal Emergency Management Agency (FEMA) in responding to domestic disasters and emergencies.; The Stafford Disaster Relief and Emergency Assistance Act requires emergency management plans to be updated every five years to remain eligible for pre-disaster and post-disaster funding.; The United States has experienced recent catastrophic disasters, including Hurricanes Harvey, Irma, and Maria, which resulted in multiple disaster declarations and emergency responses.; Objective facts about the Climate and Disaster situation:
The Robert T. Stafford Disaster Relief and Emergency Assistance Act is the primary law in the United States for disaster settings .
New York State has contracted with New York Disaster for emergency management .; The United States and its territories have mutual aid agreements to assist each other during emergencies and disasters.",NA
2017-12-01,1128393223,2017-12-01,2017-12-31,"The United States and its territories have mutual aid agreements to assist each other during emergencies and disasters.; The United States has a history of incorporating disaster relief into its legislation, dating back to the 1930s.; The recent hurricanes in the United States have raised questions about the impact of federal procurement on disaster response and recovery.; The American Red Cross responds to nearly 70,000 disasters every year, with volunteers making up over 90 percent of the Disaster workforce.; In 2017, FEMA supported 59 major disaster declarations and 16 emergency declarations.",NA
2018-01-01,767552575,2018-01-01,2018-01-31,"The United States government agencies such as FEMA, Federal Emergency Management Agency, and State Emergency Response Teams are preparing for and responding to disasters and emergencies across the country.; The 2017 calendar year saw unprecedented disasters, affecting over 25 million Americans (nearly 8% of the U.S. population).; The United States government and various organizations are providing disaster relief and emergency assistance to affected areas, including California and Puerto Rico.; The United States government has official websites providing information on disaster assistance, emergency relief, and response programs, such as disasterassistance.gov, emergency.cdc.gov, and fema.gov.; The Federal Emergency Management Agency (FEMA) provides supplemental federal disaster grant assistance to nonprofit houses of worship.",NA
2018-02-01,347496503,2018-02-01,2018-02-28,"The Federal Emergency Management Agency (FEMA) provides supplemental federal disaster grant assistance to nonprofit houses of worship.; Oklahoma County, Oklahoma, is one of the most disaster-prone counties in the United States.; The United States is currently experiencing unprecedented levels of disaster exposure.; The United States has been a major donor of bilateral disaster aid since the early 20th century.; More than 25 million Americans – almost 8 percent of the population – were affected by major disasters.",NA
2018-03-01,860803735,2018-03-01,2018-03-31,"More than 25 million Americans – almost 8 percent of the population – were affected by major disasters.; The United States has various national and state-level agencies, such as FEMA, National Guard, and state emergency management offices, that provide emergency relief support during natural disasters.; The United States has a comprehensive emergency management system in place, with laws such as the Stafford Disaster Relief and Emergency Assistance Act, and agencies like FEMA, to respond to disasters and emergencies.; The United States government has official websites and agencies dedicated to emergency preparedness and response, such as the CDC, FEMA, and the Department of Labor.; The United States government has official websites that end in.gov, ensuring their authenticity.",NA
2018-04-01,2160428171,2018-04-01,2018-04-30,"The United States government has official websites that end in.gov, ensuring their authenticity.; The CDC provides resources for helping children cope with emergencies and reaching at-risk populations in an emergency situation.; The United States government has official websites and resources dedicated to disaster preparedness, response, and relief, including FEMA.gov, transportation.gov, and klamathcounty.org.; The U.S. Department of Transportation (DOT) provides federal assistance for disaster-damaged roads and public transportation systems through two programs.; The American Federation of Teachers highlights the importance of disaster relief and emergency preparedness, particularly during hurricane season in the Caribbean, Atlantic, and Gulf coastal areas.; The US Department of Transportation provides resources for emergency relief and disaster recovery efforts, and the Federal Emergency Management Agency (FEMA) offers disaster assistance to affected individuals.",NA
2018-05-01,684764939,2018-05-01,2018-05-31,"The US Department of Transportation provides resources for emergency relief and disaster recovery efforts, and the Federal Emergency Management Agency (FEMA) offers disaster assistance to affected individuals.; Floods are the most common and costly natural disaster in the United States, with more than 200,000 floods occurring annually.; The U.S. Small Business Administration (SBA) offers low-interest disaster loans to businesses of all sizes, homeowners, and renters.; Major disaster declarations activate numerous assistance programs from FEMA to assist state or tribal governments in response and recovery efforts.; The United States government has official websites and agencies dedicated to emergency response and disaster recovery, such as the US Army Corps of Engineers (USACE) and the Federal Emergency Management Agency (FEMA).",NA
2018-06-01,509145510,2018-06-01,2018-06-30,"The United States government has official websites and agencies dedicated to emergency response and disaster recovery, such as the US Army Corps of Engineers (USACE) and the Federal Emergency Management Agency (FEMA).; Floods are the most common natural disaster in the United States and can result in loss of life, damage to property, and disruption of essential services.; The United States has laws and agencies in place to respond to disasters and emergencies, such as the Federal Emergency Management Agency (FEMA) and the Department of Health and Human Services (HHS).; The United States government has official protocols in place for declaring and responding to disasters and emergencies, including presidential declarations and state-level emergency management agencies.; The disaster management cycle consists of preparedness, response, recovery, and mitigation efforts, with preparedness being the foundation for reducing losses.",NA
2018-07-01,1545511955,2018-07-01,2018-07-31,"The disaster management cycle consists of preparedness, response, recovery, and mitigation efforts, with preparedness being the foundation for reducing losses.; The United States experiences insured losses due to natural disasters of about $15 billion a year.; Insured losses due to natural disasters in the United States total about $15 billion a year.; The primary objectives of the Jefferson County Department of Emergency Management include preparing for, responding to, and recovering from hazards and disasters, and obtaining state and/or federal disaster assistance.; The United States has a system in place for emergency alerts and warnings, including the Integrated Public Alert and Warning System (IPAWS) which became operational in 2011 and supports over 1,000 state and local authorities.; The United States government and various state and local authorities are preparing for emergencies and disasters through programs such as emergency preparedness kits, disaster volunteer recruitment, and bioterrorism emergency planning.",NA
2018-08-01,1054365212,2018-08-01,2018-08-31,"The United States government and various state and local authorities are preparing for emergencies and disasters through programs such as emergency preparedness kits, disaster volunteer recruitment, and bioterrorism emergency planning.; The Urban Areas Security Initiative grant program through the U.S. Department of Homeland Security provides funding for emergency preparedness projects.; Home fires are a significant disaster in the United States, causing 2,500 deaths and 12,600 injuries annually.; The American College of Emergency Physicians (ACEP) and the Centers for Disease Control and Prevention (CDC) offer resources for emergency preparedness and disaster response.; The U.S. Department of Homeland Security Federal Emergency Management Agency (FEMA) seeks to bring in Loaned Executives to advise on disaster development.",NA
2018-09-01,1088212750,2018-09-01,2018-09-30,"The U.S. Department of Homeland Security Federal Emergency Management Agency (FEMA) seeks to bring in Loaned Executives to advise on disaster development.; Federal Emergency Management Agency (FEMA) and the United States Department of Homeland Security (DHS) play key roles in disaster mitigation, preparedness, response, and recovery.; The U.S. government has declared various areas as disaster or emergency zones, and has activated emergency response teams to support affected communities.; The United States experienced a significant number of disaster declarations and emergency events in 2017, including hurricanes, which led to a major response from Federal Emergency Management Agency (FEMA) and other organizations.; The United States government has official websites and resources dedicated to disaster and emergency preparedness, such as FEMA and the National Business Emergency Operations Center.",NA
2018-10-01,386674265,2018-10-01,2018-10-31,"The Robert T. Stafford Disaster Relief and Emergency Assistance Act, 42 U.S.C. 5121–5207, is a federal law that provides assistance to individuals and communities affected by disasters.; The US Army Corps of Engineers (USACE) serves as the primary Federal agency for public works and emergency support in response to local disasters.; The US Department of the Interior, FEMA, and other government agencies have responded to Hurricane Michael, providing emergency services, wound care, and stress coping mechanisms.; The United States House Committee on Oversight and Accountability has been conducting oversight of the Federal Emergency Management Agency (FEMA) since 2018, focusing on recurring problems with disaster relief and emergency management.; In 2018, the President of the United States declared 62 major disasters across the country due to extreme weather and other destructive events.",NA
2018-11-01,1073836658,2018-11-01,2018-11-30,"In 2018, the President of the United States declared 62 major disasters across the country due to extreme weather and other destructive events.; The Stafford Disaster Relief and Emergency Assistance Act is a federal law that provides assistance to states affected by disasters.; The Humane Society of the United States has an Emergency Animal Relief Fund to help animals impacted by disasters or otherwise in need of urgent rescue.; The United States experiences various natural disasters, including wildfires, hurricanes, and floods, which can have devastating effects on communities.; The National Business Emergency Operations Center and the federal Disaster Distress Helpline are available to provide support during disasters.",NA
2018-12-01,474146064,2018-12-01,2018-12-31,"The National Business Emergency Operations Center and the federal Disaster Distress Helpline are available to provide support during disasters.; Objective facts about the Climate and Disaster situation:
The California Emergency Management Agency is responsible for reducing the loss of life and property and protecting the State from all hazards. 
The Federal Emergency Management Agency (FEMA) and U.S. Army Corps responded to Hurricanes Harvey, Irma, and Maria, as well as the 2017 California wildfires. 
A disaster supplies kit is a collection of basic items a household may need in the event of an emergency.; The Centers for Disease Control and Prevention (CDC) consider an “All Hazards” approach to emergency preparedness.; The Federal Emergency Management Agency (FEMA) plays a crucial role in providing flood assistance to affected areas, and the federal government can declare a federal disaster declaration in response to natural disasters.; The United States government has official websites and programs dedicated to disaster recovery, emergency management, and natural resources conservation.; The state policy for responding to disasters is to support local emergency response efforts, and in the case of a major or catastrophic disaster, the needs of the affected area are prioritized.",NA
2019-01-01,294505668,2019-01-01,2019-01-31,"The state policy for responding to disasters is to support local emergency response efforts, and in the case of a major or catastrophic disaster, the needs of the affected area are prioritized.; Objective facts about the Climate and Disaster situation:
Between 1950-2017, the Governor of California made 309 State of Emergency declarations, with 40% related to floods and 30% related to other disasters.; The United States has experienced significant disasters in the past, including large earthquakes in Idaho and hurricanes in Georgia.; The Maryland Emergency Management Agency (MEMA) provides support to people living in Maryland for disasters and events occurring within the State.; The United States government has official websites and agencies dedicated to emergency management and disaster response, such as FEMA and state-level emergency services.",NA
2019-02-01,612180570,2019-02-01,2019-02-28,"The United States government has official websites and agencies dedicated to emergency management and disaster response, such as FEMA and state-level emergency services.; The United States has a system in place for emergency management and disaster response, with federal agencies such as FEMA playing a key role in providing assistance to states during disasters.; The Stafford Disaster Relief and Emergency Assistance Act was enacted on February 29, 2016, to provide assistance in disaster relief and emergency situations.; The United States has various resources and plans in place for disaster preparedness and response, including the Federal Emergency Management Agency (FEMA), National Alliance of State Animal and Agricultural Emergency Programs, and State Emergency Management All Hazards Plans.; The Federal Emergency Management Agency (FEMA) provides individual assistance to states, commonwealths, federally recognized Indian tribes, and territories in the event of a presidential emergency declaration or major disaster declaration.",NA
2019-03-01,1376246984,2019-03-01,2019-03-31,"The Federal Emergency Management Agency (FEMA) provides individual assistance to states, commonwealths, federally recognized Indian tribes, and territories in the event of a presidential emergency declaration or major disaster declaration.; The United States government has emergency response plans in place, including the Stafford Disaster Relief and Emergency Assistance Act, to respond to public health emergencies and natural disasters.; The United States government has official websites and resources dedicated to disaster preparedness and response, such as FEMA.gov and socialwork.tulane.edu.; Wildfires are becoming larger and more frequent in the United States and Canada, in part due to the influence of climate change.; The United States Federal Emergency Management Agency (FEMA) offers resources for National disaster recovery, including debris removal and emergency protective measures.",NA
2019-04-01,630015818,2019-04-01,2019-04-30,"The Stafford Act gives the President the authority to declare that an emergency or a major disaster exists, provided that the governor of the affected state(s) requests it.; The United States is working with the Caribbean Disaster Emergency Management Agency and Regional Security System to strengthen regional response to disasters.; The United States has experienced severe winter weather, hurricanes, and wildfires, resulting in catastrophic natural disasters, such as Hurricane Katrina, which generated massive amounts of debris.; The State of New York declared a state disaster emergency on April 22, 2019.; The United States government has established programs to provide assistance to individuals affected by disasters, including Disaster Unemployment Assistance and Federal Disaster Aid.",NA
2019-05-01,695367151,2019-05-01,2019-05-31,"The United States government has established programs to provide assistance to individuals affected by disasters, including Disaster Unemployment Assistance and Federal Disaster Aid.; The United States has experienced a significant number of disasters, with Texas being the most disaster-prone state with 372 federal disaster declarations since 1953.; The Robert T. Stafford Disaster Relief and Emergency Assistance Act is a federal law that authorizes the Federal government to help State and local governments respond to disasters.; Texas ranks high among U.S. states in its number and variety of natural disasters, ranging from flooding to drought and from wildfires to ice storms.; The Galveston, TX city elevation was raised 17' and a seawall was built to protect it from future hurricanes, leading to the formation of the 1st emergency management organization.",NA
2019-06-01,421127088,2019-06-01,2019-06-30,"The Galveston, TX city elevation was raised 17' and a seawall was built to protect it from future hurricanes, leading to the formation of the 1st emergency management organization.; The United States Government has designated emergency relief programs and disaster assistance grants to support individuals and businesses affected by disasters.; The Ashtabula County Emergency Management Agency identifies mitigation activities to lessen the effects of disaster on people and property, and develops plans to respond to emergency situations.; The USDA Climate Hubs provide information on emergency preparedness for various disasters such as hurricanes, floods, earthquakes, tsunamis, and fires, with a focus on the Midwest and Puerto Rico.; The United States is increasingly reliant on federal help to address natural disasters, which is a key source of federal fiscal exposure, particularly with extreme weather events.",NA
2019-07-01,562002415,2019-07-01,2019-07-31,"The Air Force Academy is utilizing high-tech software to enhance first-responder capabilities in emergency situations.; Objective facts about the Climate and Disaster situation:
In the United States, emergency management takes a ""bottom-up"" approach to response and recovery, and can tailor a disaster declaration to include only affected areas. 
In 2017, two major hurricanes, Irma and Maria, struck Puerto Rico and the U.S. Virgin Islands, with Puerto Rico estimating significant damage.; The United States experiences significant losses due to natural disasters, with insured losses totaling around $15 billion a year.; The Georgia Emergency Management and Homeland Security Agency (GEMA/HS) operates under the authority of the Emergency Management Act to prepare for, respond to, and recover from disasters.; The United States government has official websites dedicated to disaster preparedness and emergency management, such as Ready.gov and FEMA.gov, which provide resources and information for individuals, communities, and agencies to prepare for and respond to disasters.",NA
