date,OT,start_date,end_date,search_fact,report_fact
2000-01-01,104092957,2000-01-01,2000-01-31,"The United States government has declared a disaster in Oregon due to severe winter storms in 2024, and has provided emergency disaster relief assistance to Venezuela in 1999.; The U.S. Office of Foreign Disaster Assistance (OFDA) provided a grant to the Organization of American States (OAS) to support disaster relief efforts in Venezuela in 2000.; The majority of the search results are from January 2000, and most of them are related to disaster management, emergency medical services, and healthcare systems.; The United States Government has established various policies and plans to respond to disasters and emergencies, including the Federal Response Plan (FRP) and the Robert T. Stafford Disaster Relief and Emergency Assistance Act.; Hurricane Andrew in 1992 caused $27 billion worth of property damage, making it the most expensive natural disaster in the United States at the time.; The U.S. Army North deployed a 'Super Sentinel' emergency response vehicle to Phoenix, Arizona on February 6, 2000, to support their command assessment element team.",NA
2000-02-01,116832758,2000-02-01,2000-02-29,"The U.S. Army North deployed a 'Super Sentinel' emergency response vehicle to Phoenix, Arizona on February 6, 2000, to support their command assessment element team.; The Kosovo refugee crisis in 2000 was a major emergency that required swift action to avert a disaster.; The Hawkesbury-Nepean Flood Emergency State Plan (HNFESP) is an emergency management framework document prepared under the authority of the State Emergency Service (SES) in 1993.; In the United States, the most common cause of storm-related mortality is flooding, and in the Texas floods of 1998, 76% of the deaths were due to drowning.; On February 29, 2000, the Government of Mozambique launched an emergency appeal for US$ 2.7 million for rescue operations and emergency relief assistance to flood victims.",NA
2000-03-01,101307761,2000-03-01,2000-03-31,"On February 29, 2000, the Government of Mozambique launched an emergency appeal for US$ 2.7 million for rescue operations and emergency relief assistance to flood victims.; Objective facts about the Climate and Disaster situation: 
In 2000, Mozambique, Botswana, and South Africa declared disasters due to floods, with the US Embassy providing assistance. 
In the same year, there were reports of floods, tornadoes, and citrus freezes in the United States, with affected individuals applying for disaster assistance.; The MV Estonia ferry disaster was a major disaster in modern-day Sweden.; The United States Government has provided disaster relief funds, such as the Disaster Emergency Relief Fund, to respond to emergencies.; The International Federation of Red Cross and Red Crescent Societies (IFRC) has a Disaster Services program to support the implementation of disaster response efforts.",NA
2000-04-01,68602160,2000-04-01,2000-04-30,"The International Federation of Red Cross and Red Crescent Societies (IFRC) has a Disaster Services program to support the implementation of disaster response efforts.; The 2000 Mozambique flood was a natural disaster that occurred in February and March 2000.; The Federal Emergency Management Agency (FEMA) has spent more than $25 billion to help communities recover after natural disasters in the last decade alone.; The United States government has been involved in disaster management and emergency response efforts, both domestically and internationally, with various agencies and organizations playing key roles.; The International Disasters Charter was established on April 25, 2000, with the objective of providing a unified system to support disaster relief efforts.",NA
2000-05-01,89463498,2000-05-01,2000-05-31,"Objective facts about the Climate and Disaster situation:
- Ethiopia is experiencing a drought in FY 2000. 
- Hurricane Floyd caused morbidity and mortality in North Carolina in 1999. 
- NA; The United States Geological Survey reported an earthquake measuring 7.3 on May 8, 2000.; The United States has emergency response systems in place, including the ability to provide partial payment packets for disaster relief and emergency expenditures.; The Framework Convention on Civil Defence Assistance recognizes that States have the primary responsibility to take necessary measures in the face of potential disasters or other emergency situations.; The United States government and its agencies, such as FEMA, have emergency response plans and programs in place to prepare for and respond to disasters.",NA
2000-06-01,33191224,2000-06-01,2000-06-30,"The United States government and its agencies, such as FEMA, have emergency response plans and programs in place to prepare for and respond to disasters.; The UN launched an emergency appeal for $378 million to avert the effects of drought in the Horn of Africa on June 10, 2000.; The United States government has assessed the evacuation effort during Hurricane Floyd in 1999, highlighting the importance of emergency management and response.; The UNDAC Team Mission Report states that no national state of emergency or disaster was declared for the Bengkulu Earthquake in Sumatra on June 19, 2000.; The United States government has declared states of emergency and provided disaster relief in various instances, including North Dakota and Sudan.",NA
2000-07-01,39359592,2000-07-01,2000-07-31,"The United States government has declared states of emergency and provided disaster relief in various instances, including North Dakota and Sudan.; The demands of the emergency of the Marmara earthquake in Turkey in 2000 highlighted the current weaknesses of the disaster management system.; The United States government has official agencies and laws in place to manage and respond to disasters and emergencies, such as the Federal Emergency Management Agency (FEMA) and Public Law 106-246.; The International Emergency Management Assistance Memorandum of Understanding was signed between Canada and the United States in 2000 to facilitate cooperation in emergency management.; Between 1992 and 1996, losses associated with natural disasters in the United States totaled $140 billion.; The United States has experienced various disasters and emergencies in the past, including floods, riots, and mine explosions, which have resulted in significant costs and affected many people.",NA
2000-08-01,65042923,2000-08-01,2000-08-31,"The United States has experienced various disasters and emergencies in the past, including floods, riots, and mine explosions, which have resulted in significant costs and affected many people.; The United States government has established emergency management centers and offices to provide disaster recovery assistance and respond to emergencies.; The National Guard was operating from Liberty, New York, and accepted on the emergency disaster response team in August 2000.; The United States and the United Kingdom have conducted surveys on hazards and emergency situations.; The United States government has official websites and organizations dedicated to emergency management and disaster relief, such as the Federal Emergency Management Agency (FEMA) and the United States Government's disaster relief assistance.",NA
2000-09-01,130300662,2000-09-01,2000-09-30,"The United States government has official websites and organizations dedicated to emergency management and disaster relief, such as the Federal Emergency Management Agency (FEMA) and the United States Government's disaster relief assistance.; The deadliest natural disaster in the history of the United States was caused by a hurricane.; The National Emergency Management Association reports that approximately 10% of disasters in the United States receive a state disaster declaration.; The United States government has official websites that provide information on disaster management and emergency responses.; The Federal Emergency Management Agency (FEMA) plays a crucial role in emergency management and disaster assistance in the United States.",NA
2000-10-01,40504617,2000-10-01,2000-10-31,"The Federal Emergency Management Agency (FEMA) plays a crucial role in emergency management and disaster assistance in the United States.; The United Nations has launched an Inter-Agency Appeal for Cambodia, targeting 850,000 beneficiaries and requiring $10,712,754 for emergency shelter, food, health services, water, and sanitation due to floods.; The Robert T. Stafford Disaster Relief and Emergency Assistance Act  was signed, giving the Federal Government authority to respond to disasters.; The Federal Emergency Management Agency (FEMA) provides grants to states to finance disaster relief and emergency assistance.; The United States government has passed laws and acts related to disaster relief and emergency assistance, such as Public Law 106-377 and Public Law 106-387, which provide funding and support for disaster relief efforts.; The Disaster Mitigation Act of 2000 was enacted on October 30, 2000, to provide assistance to states and local governments for disaster or emergency declarations.",NA
2000-11-01,140406792,2000-11-01,2000-11-30,"The Disaster Mitigation Act of 2000 was enacted on October 30, 2000, to provide assistance to states and local governments for disaster or emergency declarations.; The Hawaii State Civil Defence reported on a disaster in the state of Hawaii in 1997.; The Federal Emergency Management Agency (FEMA) plays a crucial role in disaster management and response in the United States.; The Andersen Fire Department has trained for any disaster, and the United States Air Force has an official website that provides information on emergency responses.; Tornadoes can occur anywhere in the United States at any time, and emergency planning is essential.",NA
2000-12-01,105902995,2000-12-01,2000-12-31,"Tornadoes can occur anywhere in the United States at any time, and emergency planning is essential.; The United States Congress assembled a Disaster Mitigation Act of 2000, which includes a declaration of major disaster or emergency and provides aid to state or local governments for disaster or emergency response.; The Federal Emergency Management Agency (FEMA) is involved in emergency management and disaster response in the United States.; In 1989, the U.S. spent $300 million in bilateral aid for foreign disasters and crises, which increased to $1.4 billion in 1994.; The year 2000 was marked by concerns about the Y2K problem, which was labeled as ""the first challenge of the 21st century"" by then-U.S. President Bill Clinton.",NA
2001-01-01,53201307,2001-01-01,2001-01-31,"The U.S. Army Corps of Engineers (USACE) aims to reduce disaster risk through collaboration with partners.; The United States Government has a registry that contains information on contractors willing to perform disaster or emergency relief activities within the United States and its outlying areas.; The United States Government has interagency plans in place to coordinate Federal assistance in the event of a disaster or emergency, including the initiation of action by the Federal Coordinating Officer (FCO) to assure Federal Assistance.; The Gujarat State Disaster Management Authority (GSDMA) was established immediately after the 26th January 2001 earthquake.; The United States experiences an average of 600 heat-related deaths every year, making extreme heat a significant natural disaster.",NA
2001-02-01,75250046,2001-02-01,2001-02-28,"The United States experiences an average of 600 heat-related deaths every year, making extreme heat a significant natural disaster.; The United States has experienced various disasters, including hurricanes, floods, earthquakes, and fires, which have resulted in damage to property and loss of life.; The US Federal Emergency Management Agency (FEMA) plays a role in disaster mitigation planning in the United States.; Vulnerability to hazards is a function of the degree of exposure to hazards and the degree of ability to cope with them.; The Nisqually earthquake of February 28, 2001, resulted in approximately 400 people injured and the state declaring a state of emergency.",NA
2001-03-01,253519064,2001-03-01,2001-03-31,"The Nisqually earthquake of February 28, 2001, resulted in approximately 400 people injured and the state declaring a state of emergency.; The involvement of civil society in crisis and disasters is committed to the provision of emergency services, as seen in the Swedish Red Cross's efforts.; The United States government and various organizations have emergency preparedness plans and disaster reduction strategies in place to mitigate the impact of natural disasters and emergencies.; The Organisation of American States (OAS) is implementing the disaster management program in St. Kitts/Nevis, and the Caribbean Disaster Emergency Response Agency is involved in the national emergency shelter policy.; The National Warning System (NAWAS) in the United States supports emergency response during natural and technological disasters.",NA
2001-04-01,128902292,2001-04-01,2001-04-30,"The National Warning System (NAWAS) in the United States supports emergency response during natural and technological disasters.; The Federal Emergency Management Agency (FEMA) coordinates federal assistance when disasters and emergencies are declared and administers a fund for this purpose.; With more people moving into disaster-prone areas, including earthquake zones, flood plains, and coastal areas in the USA, the risk of disasters will increase in years to come.; The Organization of American States (OAS) has implemented a School Vulnerability Reduction Resource Page to reduce disaster risks in schools.; The U.S. Army Corps of Engineers is involved in various disaster-related activities, including emergency response and disaster preparedness plans.; The 2001 floods in Southern Africa led to a state of disaster, with displaced person camps set up by the National Emergency Committee.",NA
2001-05-01,105717364,2001-05-01,2001-05-31,"The 2001 floods in Southern Africa led to a state of disaster, with displaced person camps set up by the National Emergency Committee.; Objective facts about the Climate and Disaster situation:
The McFarland, a deep-draft hopper dredge, conducted urgent dredging for 62 days on the Southwest Pass of the Mississippi River in May 2015. 
Disaster response workers are attempting to assess the damage in Liberia despite the challenges.; The American Red Cross and Humane Society of the United States provide tips for preparing for emergencies and disasters, including natural disasters and animal preparedness.; The United States government has laws and regulations in place for disaster mitigation and response, including the International Emergency Economic Powers Act.; President Bush declared a disaster exists in South Dakota on May 31, 2001.",NA
2001-06-01,85664740,2001-06-01,2001-06-30,"President Bush declared a disaster exists in South Dakota on May 31, 2001.; The COVID-19 pandemic was declared as an official disaster occurrence by both federal and state governments in the United States in 2001.; The U.S. Department of Homeland Security, Federal Emergency Management Agency (FEMA) plays a crucial role in disaster management.; Objective facts about the Climate and Disaster situation:
The Governor of the State of Florida must declare a “state of emergency” in order for an association to utilize the statutorily prescribed emergency powers. 
Personal generators are useful following a disaster, but they also pose safety risks if not used properly. 
In Florida, Mobile Home (MH) and Recreational Vehicle (RV) authorities have a role in preparing for emergencies.; The Mitigation Subcommittee of the NTHMP is composed of emergency managers and geoscientists from five states and two FEMA regions, aiming to mitigate tsunami disasters.",NA
2001-07-01,96335964,2001-07-01,2001-07-31,"The Mitigation Subcommittee of the NTHMP is composed of emergency managers and geoscientists from five states and two FEMA regions, aiming to mitigate tsunami disasters.; Objective facts about the Climate and Disaster situation:
The Peruvian government declared a state of emergency in the departments of Arequipa due to an earthquake on June 24, 2001. 
A flood occurred on July 8, 2001, and remains the worst disaster in local history. 
140 people were killed in a jet crash in Russia on July 4, 2001.; The United States has a framework in place for responding to disasters and emergencies, including biological and chemical terrorism, hazardous materials, and natural disasters.; The Baltimore Office of Disaster has compiled emergency preparedness documents, and the railroad industry owns almost all of the railroad infrastructure in the United States.; Objective facts about the Climate and Disaster situation:
The United States government has official websites that provide information on disaster response and recovery, such as the U.S. Department of Labor and the U.S. Army Corps of Engineers. 
Natural disasters are occurring more frequently, as stated by Iran on behalf of the Group of 77 and China at the ECOSOC meeting.; The United States Department of Agriculture (USDA) plays a role in emergency management and disaster response.",NA
2001-08-01,109690069,2001-08-01,2001-08-31,"The United States Department of Agriculture (USDA) plays a role in emergency management and disaster response.; The United States has experienced various disasters, including earthquakes, floods, and bombings, which have led to the development of emergency response procedures and disaster management strategies.; The United States has various entities and agencies responsible for disaster management, including the Federal Emergency Management Agency (FEMA), the United States Fire Administration (USFA), and the Environmental Protection Agency (EPA).; The United States government has official websites with.gov domains that belong to official government organizations.; The United States has experienced natural hazards with potential for both direct and indirect acute health consequences, such as increases in floods and tornadoes.",NA
2001-09-01,480079711,2001-09-01,2001-09-30,"The United States has experienced natural hazards with potential for both direct and indirect acute health consequences, such as increases in floods and tornadoes.; The United States has no clear evidence of causing a disaster by making an emergency declaration .; The United States Federal government has been addressing local disasters since the Congressional Act of 1803.; The Brookwood Mine Disaster occurred on September 23, 2001, resulting in the death of 13 men.; The authority for USACE to provide emergency response/disaster assistance is PL 84-99 (33 U.S.C. 701n).",NA
2001-10-01,193985674,2001-10-01,2001-10-31,"The 9/11 attacks on the World Trade Center resulted in 2,830 deaths, making it one of the deadliest disasters in the United States.; The Caribbean region was affected by Hurricane Iris in October 2001, with Belize being one of the countries impacted.; The United States government has official websites and agencies dedicated to emergency response and disaster management, such as the U.S. Department of the Interior (DOI) and the U.S. Army Corps of Engineers.; The USA PATRIOT Act of 2001 was signed into law on October 26, 2001, which includes provisions related to emergency response and disaster management.; The Federal Emergency Management Agency (FEMA) has disaster aid programs to support states in emergency situations.",NA
2001-11-01,98834991,2001-11-01,2001-11-30,"The Federal Emergency Management Agency (FEMA) has disaster aid programs to support states in emergency situations.; The World Trade Center attack on September 11, 2001, led to the development of an Office of Emergency Management in New York City.; The U.S. Army Corps of Engineers aims to reduce disaster risk and deliver vital engineering solutions to secure the Nation and energize the economy.; The United States has policies and directives in place for using military resources during peacetime civil emergencies, including natural disasters.; The Joint Commission has standards for emergency operations planning, including EM.12.01.01, which requires hospitals to develop an emergency operations plan for emergency or disaster incidents.",NA
2001-12-01,77878870,2001-12-01,2001-12-31,"The Joint Commission has standards for emergency operations planning, including EM.12.01.01, which requires hospitals to develop an emergency operations plan for emergency or disaster incidents.; The United States government has emergency management plans and agencies in place to respond to disasters, including the Federal Emergency Management Agency (FEMA) and the Office of Disaster Preparedness and Emergency Management (ODPEM).; The US Office of Foreign Disaster Assistance (OFDA) has been active in Sudan since 1987, addressing emergency needs of the war and drought-affected populations.; Objective facts about the Climate and Disaster situation:
The Federal Emergency Management Agency (FEMA) provided funds to the State of Hawaii to support disaster response efforts. 
The United States Army Corps of Engineers (USACE) has developed a disaster debris management operations plan. 
In 2001, the President of the United States declared a flood in a state as a disaster.; The United States government has provided assistance to countries affected by disasters, including Micronesia and Guinea.; The Chernobyl accident demonstrated the need to include transboundary implications in emergency plans .",NA
2002-01-01,72314436,2002-01-01,2002-01-31,"The Chernobyl accident demonstrated the need to include transboundary implications in emergency plans .; The United States has experienced various disasters and emergencies, including terrorist attacks, natural hazards, and floods, which have led to federal emergency management agency involvement and declarations of emergency.; The Citizen Corps was established in January 2002 to coordinate national efforts in emergency responders, disaster relief, and community safety.; The Stafford Disaster Relief and Emergency Assistance Act and the National Flood Insurance Act are two key laws related to disaster relief in the United States.; The Stafford Act provides for two types of disaster declarations: Emergency and Major Disaster.",NA
2002-02-01,323759888,2002-02-01,2002-02-28,"The Stafford Act provides for two types of disaster declarations: Emergency and Major Disaster.; The Stafford Disaster Relief and Emergency Assistance Act is a federal law that provides assistance to states and local governments in response to disasters and emergencies.; The United States Federal Emergency Management Agency (FEMA) categorizes natural and technological disasters.; The United States has experienced emergency situations and disasters in the past, including natural disasters, which can lead to prescription drug shortages and affect healthcare services.; The Robert T. Stafford Disaster Relief and Emergency Assistance Act is a federal law that provides assistance to states affected by disasters.",NA
2002-03-01,176923635,2002-03-01,2002-03-31,"The Robert T. Stafford Disaster Relief and Emergency Assistance Act is a federal law that provides assistance to states affected by disasters.; The Federal Emergency Management Agency (FEMA) has been active in addressing humanitarian needs in Sudan since 1987, due to war and drought-related disasters.; The Robert T. Stafford Disaster Relief and Emergency Assistance Act prohibits discrimination on the basis of race, color, religion, nationality, sex, age, or disability.; There were several disaster-related proclamations and announcements in March 2002, including a disaster proclamation in Illinois and a coronavirus disaster proclamation.; Objective facts about the Climate and Disaster situation:
The Federal Emergency Management Agency (FEMA) is an independent agency of the federal government, reporting to the president, established in 1979.",NA
2002-04-01,247574801,2002-04-01,2002-04-30,"The United States has various programs and initiatives in place to provide emergency assistance and loans to farmers, individuals, and communities affected by natural disasters and emergencies.; The USS Thresher (SSN-593) was lost on 10 April 1963 with 129 crew members, making it the worst submarine disaster in U.S. Navy history.; The State of Florida has a Comprehensive Emergency Management Plan in place, which outlines the roles and responsibilities of various agencies and officials in the event of a disaster or emergency.; The United States has guidelines and plans in place for disaster response and emergency management, including mass casualty disaster plans and emergency food assistance.; The Michigan Emergency Management Assistance Compact (MEMAC) was implemented on May 1, 2002, to facilitate the receipt of state or federal disaster funds through the Public Assistance program.",NA
2002-05-01,276490373,2002-05-01,2002-05-31,"The Michigan Emergency Management Assistance Compact (MEMAC) was implemented on May 1, 2002, to facilitate the receipt of state or federal disaster funds through the Public Assistance program.; The U.S. Agency for International Development (USAID) has an office dedicated to foreign disaster assistance (OFDA) which responds to international disasters and humanitarian crises.; The Robert T. Stafford Disaster Relief and Emergency Assistance Act is a law that provides assistance to individuals and communities affected by disasters.; The wildfires in Montana in 2000 were regarded as one of the largest natural disasters in the state's history.; The drought situation in the United States as of May 2002 is severe, with Arizona being designated as a drought disaster area.",NA
